{
  "suite": "threshold_derivation",
  "description": "Threshold derivation per the statistical companion: §3.4 for the general case, §4.3.2 for the perfect-baseline two-step, §6.3 for threshold-first inversion. The threshold is the one-sided Wilson lower bound at the *test* sample size; smaller test samples lower the threshold (§3.5).",
  "method": "Wilson lower bound at test sample size (§3.4 / §4.3.2); binary search for implied confidence (§6.3)",
  "tolerance": 1e-06,
  "cases": [
    {
      "name": "ssf_95_of_100_test50_95pct",
      "approach": "sample_size_first",
      "inputs": {
        "baseline_successes": 95,
        "baseline_trials": 100,
        "test_samples": 50,
        "confidence": 0.95
      },
      "expected": {
        "threshold": 0.872384625855458
      }
    },
    {
      "name": "ssf_950_of_1000_test100_95pct",
      "approach": "sample_size_first",
      "inputs": {
        "baseline_successes": 950,
        "baseline_trials": 1000,
        "test_samples": 100,
        "confidence": 0.95
      },
      "expected": {
        "threshold": 0.900838914720947
      }
    },
    {
      "name": "ssf_perfect_baseline_test50_95pct",
      "approach": "sample_size_first",
      "inputs": {
        "baseline_successes": 100,
        "baseline_trials": 100,
        "test_samples": 50,
        "confidence": 0.95
      },
      "expected": {
        "threshold": 0.905664335522471
      }
    },
    {
      "name": "ssf_perfect_baseline_n1000_test100_95pct",
      "approach": "sample_size_first",
      "inputs": {
        "baseline_successes": 1000,
        "baseline_trials": 1000,
        "test_samples": 100,
        "confidence": 0.95
      },
      "expected": {
        "threshold": 0.968628914619744
      }
    },
    {
      "name": "ssf_950_of_1000_test50_95pct",
      "approach": "sample_size_first",
      "inputs": {
        "baseline_successes": 950,
        "baseline_trials": 1000,
        "test_samples": 50,
        "confidence": 0.95
      },
      "expected": {
        "threshold": 0.872384625855458
      }
    },
    {
      "name": "ssf_950_of_1000_test200_95pct",
      "approach": "sample_size_first",
      "inputs": {
        "baseline_successes": 950,
        "baseline_trials": 1000,
        "test_samples": 200,
        "confidence": 0.95
      },
      "expected": {
        "threshold": 0.918108167081791
      }
    },
    {
      "name": "ssf_95_of_100_test50_99pct",
      "approach": "sample_size_first",
      "inputs": {
        "baseline_successes": 95,
        "baseline_trials": 100,
        "test_samples": 50,
        "confidence": 0.99
      },
      "expected": {
        "threshold": 0.824989729472328
      }
    },
    {
      "name": "tf_baseline_95pct_test100_threshold_90",
      "approach": "threshold_first",
      "inputs": {
        "baseline_successes": 95,
        "baseline_trials": 100,
        "test_samples": 100,
        "threshold": 0.9
      },
      "expected": {
        "implied_confidence": 0.952209647798911,
        "is_sound": true
      }
    },
    {
      "name": "tf_baseline_95pct_test100_threshold_85",
      "approach": "threshold_first",
      "inputs": {
        "baseline_successes": 95,
        "baseline_trials": 100,
        "test_samples": 100,
        "threshold": 0.85
      },
      "expected": {
        "implied_confidence": 0.997449300178152,
        "is_sound": true
      }
    },
    {
      "name": "tf_baseline_95pct_test100_threshold_94",
      "approach": "threshold_first",
      "inputs": {
        "baseline_successes": 95,
        "baseline_trials": 100,
        "test_samples": 100,
        "threshold": 0.94
      },
      "expected": {
        "implied_confidence": 0.663150192704052,
        "is_sound": false
      }
    }
  ]
}
