{
  "suite": "criterion_verdict_observational",
  "description": "Per-observational-criterion verdict cases per the statistical companion §1.4.5 (observational verdict rule) and §1.4.5a (denominator policy). The effective denominator n_c is derived from the declared policy: n_evaluable under CONDITIONAL_ON_EVALUABLE, n_attempted under MARGINAL_COUNT_UNEVALUABLE_AS_FAIL. The verdict is deterministic on (n_c, K_c): PASS if K_c == n_c and n_c > 0; FAIL if K_c < n_c; INCONCLUSIVE if n_c == 0. Observational criteria carry no Wilson construction and no alpha.",
  "method": "Deterministic application of §1.4.5's three-outcome rule at the policy-derived effective denominator n_c.",
  "tolerance": 0,
  "cases": [
    {
      "name": "pass_200_probes_zero_failures_conditional",
      "inputs": {
        "n_attempted": 200,
        "n_evaluable": 200,
        "K_c": 200,
        "denominator_policy": "CONDITIONAL_ON_EVALUABLE"
      },
      "expected": {
        "n_c": 200,
        "r_obs": 1,
        "verdict": "PASS",
        "statement": "No failure observed across 200 trials drawn from the criterion's validation set (policy: CONDITIONAL_ON_EVALUABLE)."
      }
    },
    {
      "name": "pass_200_probes_zero_failures_marginal",
      "inputs": {
        "n_attempted": 200,
        "n_evaluable": 200,
        "K_c": 200,
        "denominator_policy": "MARGINAL_COUNT_UNEVALUABLE_AS_FAIL"
      },
      "expected": {
        "n_c": 200,
        "r_obs": 1,
        "verdict": "PASS",
        "statement": "No failure observed across 200 trials drawn from the criterion's validation set (policy: MARGINAL_COUNT_UNEVALUABLE_AS_FAIL)."
      }
    },
    {
      "name": "pass_sentinel_scale_10_million_marginal",
      "inputs": {
        "n_attempted": 10000000,
        "n_evaluable": 10000000,
        "K_c": 10000000,
        "denominator_policy": "MARGINAL_COUNT_UNEVALUABLE_AS_FAIL"
      },
      "expected": {
        "n_c": 10000000,
        "r_obs": 1,
        "verdict": "PASS",
        "statement": "No failure observed across 10000000 trials drawn from the criterion's validation set (policy: MARGINAL_COUNT_UNEVALUABLE_AS_FAIL)."
      }
    },
    {
      "name": "fail_one_failure_in_1000_conditional",
      "inputs": {
        "n_attempted": 1000,
        "n_evaluable": 1000,
        "K_c": 999,
        "denominator_policy": "CONDITIONAL_ON_EVALUABLE"
      },
      "expected": {
        "n_c": 1000,
        "r_obs": 1,
        "verdict": "FAIL",
        "statement": "1 failure(s) of the criterion were observed across 1000 trials (policy: CONDITIONAL_ON_EVALUABLE)."
      }
    },
    {
      "name": "fail_one_failure_in_1000_marginal",
      "inputs": {
        "n_attempted": 1000,
        "n_evaluable": 1000,
        "K_c": 999,
        "denominator_policy": "MARGINAL_COUNT_UNEVALUABLE_AS_FAIL"
      },
      "expected": {
        "n_c": 1000,
        "r_obs": 1,
        "verdict": "FAIL",
        "statement": "1 failure(s) of the criterion were observed across 1000 trials (policy: MARGINAL_COUNT_UNEVALUABLE_AS_FAIL)."
      }
    },
    {
      "name": "inconclusive_zero_attempts_conditional",
      "inputs": {
        "n_attempted": 0,
        "n_evaluable": 0,
        "K_c": 0,
        "denominator_policy": "CONDITIONAL_ON_EVALUABLE"
      },
      "expected": {
        "n_c": 0,
        "r_obs": 0,
        "verdict": "INCONCLUSIVE",
        "statement": "No conclusive observation of the criterion was available in the run."
      }
    },
    {
      "name": "inconclusive_zero_attempts_marginal",
      "inputs": {
        "n_attempted": 0,
        "n_evaluable": 0,
        "K_c": 0,
        "denominator_policy": "MARGINAL_COUNT_UNEVALUABLE_AS_FAIL"
      },
      "expected": {
        "n_c": 0,
        "r_obs": 0,
        "verdict": "INCONCLUSIVE",
        "statement": "No conclusive observation of the criterion was available in the run."
      }
    },
    {
      "name": "policy_diff_950_evaluable_conditional_passes",
      "inputs": {
        "n_attempted": 1000,
        "n_evaluable": 950,
        "K_c": 950,
        "denominator_policy": "CONDITIONAL_ON_EVALUABLE"
      },
      "expected": {
        "n_c": 950,
        "r_obs": 0.95,
        "verdict": "PASS",
        "statement": "No failure observed across 950 trials drawn from the criterion's validation set (policy: CONDITIONAL_ON_EVALUABLE)."
      }
    },
    {
      "name": "policy_diff_950_evaluable_marginal_fails",
      "inputs": {
        "n_attempted": 1000,
        "n_evaluable": 950,
        "K_c": 950,
        "denominator_policy": "MARGINAL_COUNT_UNEVALUABLE_AS_FAIL"
      },
      "expected": {
        "n_c": 1000,
        "r_obs": 0.95,
        "verdict": "FAIL",
        "statement": "50 failure(s) of the criterion were observed across 1000 trials (policy: MARGINAL_COUNT_UNEVALUABLE_AS_FAIL)."
      }
    }
  ]
}
